label,address,kind,block,first_16_bytes,inferred_purpose,shape,key_xrefs,evidence_level,build_specific,notes
"script_string_data_pointer","0x02BF83A4","data",".data read=true write=true execute=false","00 00 00 00 00 00 00 00 00 00 00 00 00 00 00 00","Pointer to script string table base; live Town value 0x02BF8880 on 2026-05-09.","pointer; entries are 0x18 bytes, text at +0x04","004552aa READ; 00418b92 READ; 00418c56 READ; 00418ed6 READ; 0062834f WRITE; 0047bbf8 READ; 0046906b READ; 006750b6 READ; 00675153 READ; 005b6334 READ; 0069e4ce READ; 0069e4f2 READ; 0050bd5d READ; 005b62f9 READ; 005b68fa READ; 005b691d READ; 0058e3f9 READ; 00653210 READ; 00653257 READ; 0065328f READ; 006532cf READ; 004cff39 READ; 00658b29 READ; 00658bc6 READ; 006d8d5f READ; 006d8d9f READ; 006f0b84 READ; 007027a0 READ; 00506349 READ; 004fa133 READ","strong","current Steam build 65428 / t6zm.exe MD5 68C62BE753DE8ADF2C2C7B28DB769B99","vm_notify decompile references DAT_02bf83a4 for script-string values."
"scr_var_glob_candidate","0x02DEA400","data",".data read=true write=true execute=false","00 00 00 00 00 00 00 00 00 00 00 00 00 00 00 00","Start of script variable global region.","global data region","","medium","current Steam build 65428 / t6zm.exe MD5 68C62BE753DE8ADF2C2C7B28DB769B99","Nearby per-instance pointer slots and VM globals live in this data range."
"child_bucket_pointer_slot_base","0x02DEFB00","data",".data read=true write=true execute=false","00 00 00 00 00 00 00 00 00 00 00 00 00 00 00 00","Per-instance child-variable hash bucket table pointer slots.","pointer slot base + inst*0x200","005a319f DATA; 005a31be DATA; 00602126 DATA; 004da7e4 DATA; 0054a72b DATA; 008f18b7 DATA; 008f1e88 DATA; 004a200c DATA; 006015c6 DATA; 005b171a DATA; 00498876 DATA; 0045fa60 DATA; 00574531 DATA; 00574d82 DATA; 00574de6 DATA; 0059548a DATA; 006bfb4e DATA; 006e52da DATA","strong","current Steam build 65428 / t6zm.exe MD5 68C62BE753DE8ADF2C2C7B28DB769B99","vm_notify decompile references DAT_02defa00 and companion tooling resolves bucket slots."
"child_variables_pointer_slot_base","0x02DEFB80","data",".data read=true write=true execute=false","00 00 00 00 00 00 00 00 00 00 00 00 00 00 00 00","Per-instance child-variable table pointer slots.","pointer slot base + inst*0x200; child entry size 0x1c","005df98f READ; 0083fdf7 READ; 008f39c4 DATA; 005fb9a0 DATA; 005fba8e DATA; 005fbab9 DATA; 005fbb1d DATA; 005b3b44 DATA; 005b3b70 DATA; 005b3ba6 DATA; 0043bcbd DATA; 0043bd1d DATA; 0043bda0 DATA; 0043be24 DATA; 0043be80 DATA; 0043bee7 DATA; 0043bf30 DATA; 0043bf97 DATA; 0043bfd0 DATA; 0043c037 DATA; 0043c080 DATA; 0043c149 DATA; 004ebe74 DATA; 004ebf8d DATA; 008f4bbe DATA; 008f5b83 DATA; 008f5e51 DATA; 008f5995 DATA; 008f59e4 DATA; 008f65ff DATA","strong","current Steam build 65428 / t6zm.exe MD5 68C62BE753DE8ADF2C2C7B28DB769B99","vm_notify decompile uses DAT_02defb80 with child id * 0x1c."
"vm_notify_callback_table_base","0x02DF4170","data",".data read=true write=true execute=false","00 00 00 00 00 00 00 00 00 00 00 00 00 00 00 00","Per-instance optional notify callback pointer checked by vm_notify.","code pointer at base + inst*0x42a8","008f3230 DATA","medium","current Steam build 65428 / t6zm.exe MD5 68C62BE753DE8ADF2C2C7B28DB769B99","vm_notify calls callback when non-null before variable lookup."
"vm_notify_remap_a","0x024BB4CC","data",".data read=true write=true execute=false","00 00 00 00 00 00 00 00 00 00 00 00 00 00 00 00","Script string id remapped by vm_notify when inst is 0; live Town ID 5351 = death.","uint16 runtime script string id","00685df6 READ; 00700e95 READ; 0050f292 READ; 008f31e6 READ; 0047f8eb READ; 00504ef0 READ; 005059e8 READ; 008339e4 READ; 008341b5 READ; 00834ee5 READ; 00834f00 READ; 00835ed6 READ; 006e19cf READ; 0082f48f READ; 0082f50f READ; 0054d370 READ; 00430913 READ; 0101de84 DATA; 0047a4a2 WRITE","medium","current Steam build 65428 / t6zm.exe MD5 68C62BE753DE8ADF2C2C7B28DB769B99","vm_notify compares notify stringValue to this global."
"vm_notify_remap_b","0x024BB4CE","data",".data read=true write=true execute=false","00 00 00 00 00 00 00 00 00 00 00 00 00 00 00 00","Second script string id remapped by vm_notify when inst is 0; live Town ID 5352 = disconnect.","uint16 runtime script string id","008f3203 READ","medium","current Steam build 65428 / t6zm.exe MD5 68C62BE753DE8ADF2C2C7B28DB769B99","vm_notify compares notify stringValue to this global."
"vm_notify_remap_target","0x024BB4D0","data",".data read=true write=true execute=false","00 00 00 00 00 00 00 00 00 00 00 00 00 00 00 00","Replacement script string id used by vm_notify remap; live Town ID 5353 = death_or_disconnect.","uint16 runtime script string id","008f31f4 READ; 008f3211 READ","medium","current Steam build 65428 / t6zm.exe MD5 68C62BE753DE8ADF2C2C7B28DB769B99","vm_notify recursively calls itself with this value."
